{
  "meta": {
    "version": "0.1.0",
    "generatedAt": "2026-03-29T00:00:00Z",
    "sourceOfTruth": [
      "apps/web/tailwind.config.ts",
      "apps/web/src/styles.css",
      "apps/web/src/components/common/*",
      "docs/ux-design/tailwind.config.cjs"
    ],
    "notes": [
      "Current implementation baseline.",
      "Legacy references are marked.",
      "Structured for Penpot MCP handoff."
    ]
  },
  "tokens": {
    "color": {
      "palette.core": {
        "value": {
          "kac-steel-light": "#F4F4F5",
          "kac-iron": "#1F2937",
          "kac-iron-dark": "#101B26",
          "kac-blood-light": "#E82029",
          "kac-fire-light": "#FDAD19",
          "kac-bone-light": "#E8D1B6",
          "kac-gold": "#F7B500",
          "kac-gold-dark": "#F8A732",
          "kac-cloth-light": "#82A1BA",
          "kac-curse": "#E83E8C",
          "kac-monster-dark": "#28B13A",
          "special": "#d99600",
          "success": "#28B13A",
          "partial": "#6F8098",
          "chaos": "#E6458B",
          "fumble": "#101B26",
          "ink": "#111827",
          "paper": "#f8fafc"
        },
        "status": "canonical",
        "source": ["apps/web/tailwind.config.ts"],
        "notes": "Core active palette for primitives and outcomes."
      },
      "literals.current": {
        "value": {
          "off-white": "#fffdf5",
          "parchment": "#f8efd8",
          "shadow-cream": "#fffaf0",
          "shadow-tan": "#d6c1a1",
          "shadow-umber": "#9f8a6d",
          "message-highlight-rgb": "255 210 59"
        },
        "status": "current-only",
        "source": ["apps/web/src/components/common/Message.tsx"],
        "notes": "Hardcoded component literals."
      }
    },
    "spacing": {
      "scale.tailwind-used": {
        "value": ["0", "0.5", "1", "1.5", "2", "2.5", "3", "4", "5", "6", "7", "8", "10", "12"],
        "status": "canonical",
        "source": ["apps/web/src/components/common/Button.tsx"],
        "notes": "Observed spacing steps."
      },
      "layout.shell": {
        "value": {
          "maxWidth": "1120px",
          "padding": "1.25rem"
        },
        "status": "canonical",
        "source": ["apps/web/src/styles.css"],
        "notes": "App shell constraints."
      },
      "exceptions": {
        "value": {
          "panelFrame": "4px",
          "fadeMask": "14px",
          "halftoneGrid": "10px",
          "paperShadowInset": "-10px -20px"
        },
        "status": "current-only",
        "source": ["apps/web/src/components/common/Panel.module.css"],
        "notes": "Effect-specific spacing values."
      }
    },
    "typography": {
      "families": {
        "value": {
          "md-body": "Shantell Sans, cursive",
          "md-heading": "Kalam, cursive",
          "md-title": "Passion One, sans-serif",
          "md-logo": "Kalam, cursive"
        },
        "status": "canonical",
        "source": ["apps/web/tailwind.config.ts"],
        "notes": "Configured font aliases."
      },
      "sizes": {
        "value": {
          "2xs": ["0.6rem", "0.75rem"],
          "3xs": ["0.5rem", "0.6rem"]
        },
        "status": "canonical",
        "source": ["apps/web/tailwind.config.ts"],
        "notes": "Custom tiny sizes."
      },
      "textVariants": {
        "value": {
          "h1": "font-heading font-bold text-4xl/none sm:text-5xl/none",
          "h2": "font-heading font-bold text-3xl/none sm:text-4xl/none",
          "h3": "font-heading font-bold text-2xl/none sm:text-3xl/none",
          "body": "font-ui text-base leading-relaxed",
          "quote": "font-ui text-lg italic leading-relaxed",
          "note": "font-ui text-xs leading-snug opacity-70"
        },
        "status": "canonical",
        "source": ["apps/web/src/components/common/Text.tsx"],
        "notes": "Shared text styles."
      },
      "legacy.title-effects": {
        "value": ["drop.title", "drop.emboss"],
        "status": "legacy-reference",
        "source": ["docs/ux-design/tailwind.config.cjs"],
        "notes": "Legacy style references kept for migration context."
      }
    },
    "radius": {
      "core": {
        "value": {
          "rounded-sm": "0.125rem",
          "rounded-full": "9999px"
        },
        "status": "canonical",
        "source": ["apps/web/src/components/common/Button.tsx"],
        "notes": "Main shape radii."
      }
    },
    "border": {
      "widths": {
        "value": {
          "control": "2px",
          "input": "3px",
          "inputBottom": "6px",
          "focusRing": "2px",
          "focusHighlight": "10px",
          "panelFrame": "4px"
        },
        "status": "current-only",
        "source": ["apps/web/src/components/common/TextField.tsx", "apps/web/src/components/common/TextArea.tsx"],
        "notes": "Observed border widths."
      }
    },
    "shadow": {
      "tailwindDrop": {
        "value": ["md-heavy", "lg-heavy", "xl-heavy", "title", "emboss"],
        "status": "canonical",
        "source": ["apps/web/tailwind.config.ts"],
        "notes": "Configured drop shadow token names."
      },
      "component": {
        "value": {
          "button": "3px 3px 0 0 #121b23",
          "panelInset": "inset 1px 1px 0 0 #fffaf0, inset -1px -1px 0 0 #d6c1a1",
          "toggleInset": "inset 1px 1px 0 0 #fffaf0, inset -1px -1px 0 0 #9f8a6d"
        },
        "status": "current-only",
        "source": ["apps/web/src/components/common/Panel.tsx"],
        "notes": "Arbitrary class shadows."
      }
    },
    "motion": {
      "tailwind": {
        "value": {
          "fadeIn": "fadeIn 0.6s ease-in-out",
          "fadeOut": "fadeOut 0.6s ease-in-out",
          "wave": "wave 0.6s linear infinite",
          "breathe": "breathe 1s ease-in-out infinite"
        },
        "status": "canonical",
        "source": ["apps/web/tailwind.config.ts"],
        "notes": "Configured animation aliases."
      },
      "cssModules": {
        "value": {
          "pendingDot": "0.5s",
          "highlightOnce": "1s",
          "highlightLoop": "3s",
          "messagePulse": "1.8s"
        },
        "status": "current-only",
        "source": ["apps/web/src/components/common/Message.module.css"],
        "notes": "Component-local keyframes."
      }
    },
    "zIndex": {
      "layers": {
        "value": {
          "root": 1,
          "panelContent": 10,
          "overlay": 20,
          "vignette": 50
        },
        "status": "current-only",
        "source": ["apps/web/src/styles.css"],
        "notes": "Observed stack layers."
      }
    }
  },
  "semantic": {
    "surface.base": { "alias": "surface.base", "ref": "tokens.color.palette.core.value.kac-steel-light", "status": "canonical", "notes": "Page base", "source": ["apps/web/src/styles.css"] },
    "surface.panel": { "alias": "surface.panel", "ref": "tokens.color.palette.core.value.kac-bone-light", "status": "canonical", "notes": "Default panel", "source": ["apps/web/src/components/common/Panel.tsx"] },
    "surface.callout": { "alias": "surface.callout", "ref": "tokens.color.palette.core.value.kac-cloth-light", "status": "canonical", "notes": "Info callouts", "source": ["apps/web/src/components/common/Message.tsx"] },
    "text.primary": { "alias": "text.primary", "ref": "tokens.color.palette.core.value.kac-iron", "status": "canonical", "notes": "Default text", "source": ["apps/web/src/components/common/Text.tsx"] },
    "text.muted": { "alias": "text.muted", "ref": "tokens.color.palette.core.value.kac-steel-light", "status": "canonical", "notes": "Muted text", "source": ["apps/web/src/components/common/Text.tsx"] },
    "action.primary": { "alias": "action.primary", "ref": "tokens.color.palette.core.value.kac-gold", "status": "canonical", "notes": "Primary button", "source": ["apps/web/src/components/common/Button.tsx"] },
    "action.secondary": { "alias": "action.secondary", "ref": "tokens.color.palette.core.value.kac-cloth-light", "status": "canonical", "notes": "Secondary button", "source": ["apps/web/src/components/common/Button.tsx"] },
    "status.success": { "alias": "status.success", "ref": "tokens.color.palette.core.value.success", "status": "canonical", "notes": "Success", "source": ["apps/web/tailwind.config.ts"] },
    "status.partial": { "alias": "status.partial", "ref": "tokens.color.palette.core.value.partial", "status": "canonical", "notes": "Partial", "source": ["apps/web/tailwind.config.ts"] },
    "status.chaos": { "alias": "status.chaos", "ref": "tokens.color.palette.core.value.chaos", "status": "canonical", "notes": "Chaos", "source": ["apps/web/tailwind.config.ts"] },
    "status.fumble": { "alias": "status.fumble", "ref": "tokens.color.palette.core.value.fumble", "status": "canonical", "notes": "Fumble", "source": ["apps/web/tailwind.config.ts"] }
  },
  "components": {
    "Button": { "description": "Tactile CTA", "variants": { "solid": { "description": "Raised gradient", "tokens": ["action.primary", "tokens.border.widths", "tokens.shadow.component"], "states": ["default", "hover", "active", "disabled", "focus-visible"] }, "ghost": { "description": "Transparent", "tokens": ["text.primary", "tokens.border.widths"], "states": ["default", "hover", "disabled"] }, "circle": { "description": "Round icon", "tokens": ["tokens.radius.core", "tokens.spacing.scale.tailwind-used"], "states": ["default", "active", "disabled"] } }, "tokenRefs": ["tokens.color", "tokens.spacing", "tokens.border", "tokens.shadow", "tokens.motion"], "source": ["apps/web/src/components/common/Button.tsx"] },